{
  "slug": "github",
  "name": "GitHub",
  "website": "https://github.com",
  "category": "Developer tools",
  "summary": "Registering a GitHub OAuth App is fully self-serve, with no GitHub review, and works for any GitHub user within minutes. The real friction is on the customer's side: new GitHub organisations restrict OAuth Apps by default, so each B2B customer's org owner has to approve your app before the agent can reach private org repos.",
  "lastVerified": "2026-10-29",
  "origin": "curated",
  "verdict": {
    "difficulty": "Easy",
    "difficultyReason": "No app review, verification or security assessment for OAuth Apps. One registration serves every GitHub user. The main hurdle is per-customer approval by org owners (OAuth app access restrictions), and that sits with the customer, not with GitHub.",
    "milestones": [
      {
        "id": "test",
        "label": "Working with your own account",
        "activeEffort": "10-20 min",
        "calendarWait": "None",
        "approvalRequired": false,
        "whatYouGet": "A Client ID and secret in a Composio custom auth config. Your own account connects with your app name on the consent screen.",
        "limits": "Your own orgs may still need you (as owner) to grant the app access. Since Aug 2026, new apps issue 8-hour access tokens with 6-month refresh tokens by default.",
        "evidence": {
          "level": "sourced",
          "sourceIds": [
            28,
            26,
            2,
            4
          ],
          "note": "Seen in our test on 29 Oct 2026: we completed this milestone (new OAuth App, Composio custom auth config, connected account Active [28]), and 'Expire user access tokens' was checked by default on the form [26]. From GitHub's docs, not seen: the 8-hour and 6-month token lifetimes, that your own orgs may need you to grant access, and that your app name shows on the consent screen. Org access was not tested."
        },
        "notes": "Hands-on: about 10 minutes in our 29 Oct 2026 test (register the app, generate a secret, create the Composio auth config, connect). The range allows for choosing scopes and registering under an org."
      },
      {
        "id": "production",
        "label": "Any GitHub user can connect",
        "activeEffort": "30-90 min",
        "calendarWait": "Hours to weeks, per customer org",
        "approvalRequired": false,
        "approvalName": "None from GitHub. Each customer org owner approves the app under Org settings > Third-party Access > OAuth app policy.",
        "whatYouGet": "The same app works for any GitHub user right away. Personal repos and public data work immediately, and org private repos work once the org owner approves.",
        "limits": "OAuth tokens draw on each user's shared 5,000 req/hr REST budget, which does not scale. There are no read-only private-repo scopes: 'repo' is full read/write. Ten tokens at most per user/app/scope combination. Exception: OAuth apps owned or approved by a GitHub Enterprise Cloud org get 15,000 requests/hr for that org's members.",
        "evidence": {
          "level": "unverified",
          "sourceIds": [
            1,
            6,
            7,
            9,
            10,
            3
          ],
          "note": "Limits and the approval mechanism are from GitHub's docs; the hands-on time and the customer-side wait are our estimates."
        },
        "notes": "Waiting: None from GitHub; per customer org, from hours to weeks for owner approval (no SLA, depends on the customer)."
      },
      {
        "id": "listing",
        "label": "GitHub Marketplace listing (optional)",
        "activeEffort": "3-8 hours",
        "calendarWait": "1-4 weeks (estimate)",
        "approvalRequired": true,
        "approvalName": "Marketplace listing review by a GitHub onboarding expert, plus Publisher Verification for paid plans",
        "whatYouGet": "Discoverability in GitHub Marketplace, and Marketplace billing if paid.",
        "limits": "Paid listings need a verified-publisher org and at least 200 users for an OAuth App. Only org owners can submit org-owned listings.",
        "evidence": {
          "level": "sourced",
          "sourceIds": [
            14,
            15
          ],
          "note": "Requirements are sourced. The wait range is unverified because no official timeline exists. Not needed for Composio connections."
        },
        "notes": "Hands-on: 3-8 h (listing copy, pricing plan, webhooks, policy links). Waiting: Unknown; GitHub publishes no SLA. Estimate 1-4 weeks for onboarding review plus publisher verification."
      }
    ],
    "topBlockers": [
      {
        "title": "Org OAuth app access restrictions block private org repos",
        "detail": "New orgs have OAuth app access restrictions on by default. Until an org owner approves your app, tokens see only public org resources and cannot make privileged writes, so the agent appears to 'see no private org repos'. Members can only request access.",
        "evidence": {
          "level": "sourced",
          "sourceIds": [
            6,
            7,
            8,
            20
          ],
          "note": "The Composio KB confirms that reconnecting in Composio does not bypass the policy."
        }
      },
      {
        "title": "'repo' scope is all-or-nothing",
        "detail": "OAuth Apps cannot use fine-grained permissions. Reading issues or PRs in a private repo needs 'repo', which also grants write access to code, so security-conscious org owners may refuse approval. A GitHub App is the alternative if this is a dealbreaker.",
        "evidence": {
          "level": "sourced",
          "sourceIds": [
            1,
            9
          ]
        }
      },
      {
        "title": "Expiring tokens are now on by default",
        "detail": "Since 14 Aug 2026, new OAuth Apps have 'Expire user access tokens' checked: 8-hour access tokens and 6-month refresh tokens. If the refresh is not handled, connections die after 8 hours. Existing apps are not switched over automatically.",
        "evidence": {
          "level": "sourced",
          "sourceIds": [
            26,
            4,
            2
          ],
          "note": "Seen in our test on 29 Oct 2026: 'Expire user access tokens' was checked by default on a new OAuth App [26], with GitHub's text 'This will provide a refresh_token which can be used to request an updated access token when this access token expires.' From GitHub's docs, not seen: the 14 Aug 2026 date, the 8-hour and 6-month lifetimes, and that existing apps are not switched over. Whether Composio refreshes GitHub tokens is not documented; see openQuestions."
        }
      },
      {
        "title": "SSO orgs need an active SSO session at authorisation",
        "detail": "For orgs with SSO enforced (Enterprise Cloud), the user must have an active SSO session for that org when they authorise. Otherwise the token is not authorised for the org, even once the app is approved.",
        "evidence": {
          "level": "sourced",
          "sourceIds": [
            13
          ]
        }
      }
    ]
  },
  "composio": {
    "toolkitSlug": "github",
    "managedAuth": "yes",
    "meanwhile": "Use Composio-managed GitHub OAuth for internal testing; the consent screen says 'Composio'. Note that customer org owners would have to approve Composio's shared app rather than yours. Switching to a custom auth config later affects only new connections; existing users must reconnect.",
    "redirectUriNote": "Copy the exact redirect URI the Composio dashboard shows when you create the auth config (Auth Configs > Create Auth Config > GitHub > Your Own Credentials). On 29 Oct 2026 it showed https://backend.composio.dev/api/v1/auth-apps/add; some Composio docs and examples show https://backend.composio.dev/api/v3/toolkits/auth/callback. It must match exactly, and you can change it in the dashboard to white-label the callback on your own domain. GitHub OAuth Apps accept up to 10 redirect URIs, so you can also register the other path if you are unsure.",
    "evidence": {
      "level": "sourced",
      "sourceIds": [
        25,
        17,
        18,
        0,
        19,
        26
      ],
      "note": "Seen in our test on 29 Oct 2026: the redirect URI in the Composio dashboard, with an edit icon [25], and the 10-URI limit on GitHub's form [26]. From Composio's docs, not seen: the v3 path, managed GitHub auth and its 'Composio' consent screen, that switching to a custom auth config affects only new connections, and that the URI can be changed to white-label the callback (we saw the edit icon but did not change it). That customer org owners would approve Composio's shared app rather than yours follows from GitHub's org approval rules, not from our test."
    }
  },
  "prerequisites": [
    {
      "item": "A GitHub account with 2FA, ideally an org you own to host the app",
      "detail": "Register under an org (Org settings > Developer settings > OAuth Apps) so the app is not tied to one person. Org-owned apps also get automatic access to that org's resources.",
      "owner": "you",
      "evidence": {
        "level": "sourced",
        "sourceIds": [
          6,
          2
        ],
        "note": "The 2FA recommendation is ours. GitHub requires 2FA only for publisher verification."
      }
    },
    {
      "item": "A Composio project with API access",
      "detail": "You need the dashboard's Auth Configs page to create a GitHub auth config with your own credentials.",
      "owner": "you",
      "evidence": {
        "level": "reported",
        "sourceIds": [
          0,
          19
        ],
        "note": "Composio vendor docs."
      }
    },
    {
      "item": "Public homepage URL and app name",
      "detail": "Both are shown on the consent screen and are public, so avoid internal URLs or secrets in any field.",
      "owner": "agent_assist",
      "evidence": {